[
    {
        "title": "Elde titreme ve hareketlerde yavaşlama Parkinson belirtisi olabilir",
        "date": "2025-04-11",
        "source": "TRT Haber",
        "text": "Dünya genelinde yaşlanan nüfusla birlikte Parkinson hastalığında hızlı bir artış gözleniyor. Genellikle 60 yaş üzeri bireylerde görülen hastalığın henüz kesin bir tedavisi olmasa da doğru müdahale ile yaşam kalitesi büyük ölçüde iyileştirilebiliyor. \n\n\n11/04/2025 10:15\n© TRT HABER"
    },
    {
        "title": "Sağlıklı Hayat Akademisi projesi başlıyor",
        "date": "2025-04-10",
        "source": "TRT Haber",
        "text": "Sağlık Bakanlığı, toplum sağlığı konusunda farkındalık geliştirmek, sağlıklı yaşam kültürünü yaygınlaştırmak amacıyla Sağlıklı Hayat Merkezlerinde \"Sağlıklı Hayat Akademisi\" projesini hayata geçirecek.\n10/04/2025 11:22\n© TRT HABER"
    },
    {
        "title": "Türkiye nakillerde ilk sırada",
        "date": "2025-04-09",
        "source": "AA",
        "text": "Sağlık Bakanlığı Doku, Organ Nakli ve Diyaliz Hizmetleri Daire Başkanı Doç. Dr. Erkan Ölçücüoğlu, Türkiye'nin kadavradan nakillerde dünyada üçüncü, canlıdan nakillerde ise birinci sırada olduğunu söyledi.\n09/04/2025 15:48\n© TRT HABER"
    },
    {
        "title": "Bakan Memişoğlu: Sağlık alanındaki tecrübelerimizi Türk devletleriyle paylaşmaya hazırız",
        "date": "2025-04-08",
        "source": "AA",
        "text": "Sağlık Bakanı Kemal Memişoğlu, Türkiye'de son 20 yılda sağlık sektöründe büyük dönüşüm yaşandığını ve bu alanındaki tecrübelerini Türk devletleriyle paylaşmaya hazır olduklarını söyledi.\n08/04/2025 21:52\n© TRT HABER"
    },
    {
        "title": "Türk Devletleri Teşkilatı Sağlık Bakanları Kazakistanda toplandı",
        "date": "2025-04-08",
        "source": "AA",
        "text": "Türk Devletleri Teşkilatı (TDT) Sağlık Bakanları 5’inci Toplantısı Kazakistan’ın başkenti Astana’da düzenlendi. Toplantıda konuşan Sağlık Bakanı Memişoğlu, Türkiye’nin yıllardır sürdürdüğü sağlık reformlarıyla birinci basamak sağlık hizmetlerinde önemli başarılar elde ettiğinin altını çizdi.\n08/04/2025 13:21\n© TRT HABER"
    },
    {
        "title": "Mevsim geçişlerinde cilt kuruluğuna dikkat",
        "date": "2025-04-08",
        "source": "TRT Haber",
        "text": "Mevsim geçişleri cildi de etkiliyor. Özellikle havaların değişken olduğu bahar aylarında birçok kişi ciltte kuruluk, gerginlik, pullanma ve kaşıntı gibi sorunlarla karşı karşıya kalıyor. Uzmanlara göre, bu dönemde cildin nem dengesi bozuluyor ve doğru önlemler alınmadığında cilt sağlığı tehdit altına girebiliyor.\n08/04/2025 09:08\n© TRT HABER"
    },
    {
        "title": "Sağlık Bakanlığından sağlık okuryazarlığı için yeni eylem planı",
        "date": "2025-04-07",
        "source": "AA",
        "text": "Sağlık Bakanlığı, \"Sağlıklı Türkiye Yüzyılı\" vizyonu doğrultusunda Türkiye genelinde sağlık okuryazarlığını artırmak amacıyla eğitim ve sağlık sektörünün içinde yer alacağı kapsamlı bir seferberlik başlatıyor.\n\n\n07/04/2025 11:25\n© TRT HABER"
    },
    {
        "title": "Tüberküloz hastalarına yakın takip",
        "date": "2025-04-03",
        "source": "AA",
        "text": "Sağlık Bakanlığınca tüm ilaçları ücretsiz sağlanan tüberküloz hastalarının düzenli ilaç kullanımları da gözetimli tedavi uygulamasıyla yakından takip ediliyor.\n03/04/2025 11:28\n© TRT HABER"
    },
    {
        "title": "İstanbul'da geçen yıl 89 bin çocuğa otizm taraması yapıldı",
        "date": "2025-04-02",
        "source": "AA",
        "text": "İstanbul'da geçen yıl 1,5-3 yaş arası 89 bin çocuk otizm spektrum bozukluğu açısından tarandı. Taramalarda aile hekimleri 4 bin 900'ünü 'riskli' olarak değerlendirdi.\n02/04/2025 15:49\n© TRT HABER"
    },
    {
        "title": "Sağlık Bakanlığı: Sevdiklerimize ücretsiz kanser taramalarını hatırlatalım",
        "date": "2025-04-01",
        "source": "AA",
        "text": "Sağlık Bakanlığınca 1-7 Nisan Ulusal Kanser Haftası dolayısıyla yapılan paylaşımda, \"Sevdiklerimize ücretsiz kanser taramalarını hatırlatalım.\" ifadesi kullanıldı.\n01/04/2025 14:52\n© TRT HABER"
    },
    {
        "title": "12 kez kalbi duran hasta sağlık ekiplerinin çabasıyla hayata döndürüldü",
        "date": "2025-03-30",
        "source": "AA",
        "text": "Antalya'nın Manavgat ilçesinde göğüs ağrısı şikayetiyle hastaneye başvuran 65 yaşındaki Vural Gül, acil serviste 12 kez duran kalbini elektroşokla çalıştırarak kendisini hayata bağlayan ekibi ziyaret etti.\n30/03/2025 14:40\n© TRT HABER"
    },
    {
        "title": "9 sağlık meslek grubunda 420 bin yeni istihdam alanı",
        "date": "2025-03-29",
        "source": "AA",
        "text": "Sağlık Bakanı Kemal Memişoğlu, sağlık hizmetleri ve tesislerinin niteliğini artıracak kapsamlı düzenlemeler yaptıklarını belirterek, \"Bugün Resmi Gazete'de yayımlanan yönetmelikle, 9 sağlık meslek grubunda yaklaşık 420 bin sağlık çalışanı için yeni istihdam alanı oluşturuyoruz\" ifadesini kullandı.\n29/03/2025 16:10\n© TRT HABER"
    },
    {
        "title": "420 bin sağlık çalışanı için yeni istihdam alanı oluşturulacak",
        "date": "2025-03-29",
        "source": "DHA",
        "text": "Sağlık Bakanı Kemal Memişoğlu, \"9 sağlık meslek grubunda yaklaşık 420 bin sağlık çalışanı için yeni istihdam alanı oluşturuyoruz\" dedi. Sağlık Bakanlığının ilgili yönetmeliği Resmi Gazete'de yayımlandı. Yeni düzenleme ile hasta haklarını korumaya yönelik önemli adımlar atıldı.\n29/03/2025 03:11\n© TRT HABER"
    },
    {
        "title": "Modern hayatın sessiz sorunu: Uykusuzluk",
        "date": "2025-03-27",
        "source": "TRT Haber",
        "text": "Uykusuzluk sadece geceleri değil, tüm günü etkileyen bir sorun. Kalitesiz uyku yorgunluk, unutkanlık ve düşük motivasyona yol açarken, uzun vadede ciddi sağlık problemlerine davetiye çıkarabiliyor. Peki, deliksiz bir uyku için neler yapılmalı?\n27/03/2025 12:25\n© TRT HABER"
    },
    {
        "title": "Duman avcıları bayramda da iş başında",
        "date": "2025-03-26",
        "source": "AA",
        "text": "Sağlık Bakanlığı Halk Sağlığı Genel Müdürü Muhammed Emin Demirkol, tütünle mücadele kapsamında yürütülen çapraz denetim uygulamasının Ramazan Bayramı'nda da kesintisiz süreceğini aktardı.\n26/03/2025 11:54\n© TRT HABER"
    },
    {
        "title": "Bakan Memişoğlu: Aile Sağlığı Merkezlerimizi güçlendirmeye kesintisiz olarak devam edeceğiz",
        "date": "2025-03-25",
        "source": "AA",
        "text": "Sağlık Bakanı Kemal Memişoğlu, \"Vatandaşlarımızın sağlık hizmetlerine erişimini daha kolay hale getirmek için Aile Sağlığı Merkezlerimizi güçlendirmeye kesintisiz olarak devam edeceğiz\" ifadelerini kullandı.\n\n\n26/03/2025 00:54\n© TRT HABER"
    },
    {
        "title": "MHRS üzerinden 2 milyardan fazla randevu verildi",
        "date": "2025-03-23",
        "source": "AA",
        "text": "Sağlık Bakanlığı, 2010'da hizmete sunulan Merkezi Hekim Randevu Sisteminden (MHRS) bugüne kadar 2 milyar 169 milyon 281 bin 283 randevu verildiğini açıkladı.\n23/03/2025 11:29\n© TRT HABER"
    },
    {
        "title": "Tükettiğimiz besinler psikolojimizi nasıl etkiliyor?",
        "date": "2025-03-22",
        "source": "TRT Haber",
        "text": "Yediğimiz her lokma sadece bedenimizi değil, ruhumuzu da şekillendiriyor. Sağlıklı beslenme, depresyon ve anksiyete riskini azaltırken, bilinçsiz gıda tüketimi psikolojimizi de tehdit ediyor. İşte besinler ve ruh sağlığı arasındaki çarpıcı ilişki… \n22/03/2025 12:33\n© TRT HABER"
    },
    {
        "title": "Bir saat süren kalp mesajıyla hayata yeniden döndü",
        "date": "2025-03-22",
        "source": "AA",
        "text": "Antalya'da geçirdiği kalp krizi sonucu kalbi duran 51 yaşındaki mekanik tesisatçı, hastane acil servisinde yaklaşık bir saat yapılan kalp masajı ve elektroşok uygulamalarıyla hayata döndürüldü.\n22/03/2025 11:45\n© TRT HABER"
    },
    {
        "title": "Sağlık Bakanlığından özel çocuklar için beslenme kitabı",
        "date": "2025-03-21",
        "source": "AA",
        "text": "Sağlık Bakanlığınca, özel gereksinimli çocukların beslenmesinde bilimsel ve güncel yaklaşımların yer aldığı beslenme kitabı hazırlandı.\n21/03/2025 11:58\n© TRT HABER"
    },
    {
        "title": "Türkiye'de geçen yıl 2 milyon 700 bin kolorektal kanser taraması yapıldı",
        "date": "2025-03-20",
        "source": "AA",
        "text": "Sağlık Bakanlığınca, 50-70 yaş arasındaki kişilere 2 yılda bir ücretsiz uygulanan kolorektal (kalın bağırsak) kanser taraması kapsamında, 2024'te 2 milyon 700 bin gaitada gizli kan kitiyle test yapıldı.\n20/03/2025 11:47\n© TRT HABER"
    },
    {
        "title": "Sağlıklı Yaşa, Sağlıkla Yaşlan",
        "date": "2025-03-20",
        "source": "AA",
        "text": "Sağlık Bakanlığı, \"Ulusal Yaşlılar Haftası\"nın bu yılki temasının \"Sağlıklı Yaşa, Sağlıkla Yaşlan\" olarak belirlendiğini bildirdi.\n20/03/2025 10:38\n© TRT HABER"
    },
    {
        "title": "2024TUS 2. Dönem uzmanlık dalı değişikliği tercihleri başladı",
        "date": "2025-03-19",
        "source": "AA",
        "text": "2024 Tıpta Uzmanlık Eğitimi Giriş Sınavı (2024-TUS) 2. Dönem uzmanlık dalı değişikliği için tercihler, 23 Mart saat 23.59'a kadar alınacak.\n\n\n19/03/2025 16:27\n© TRT HABER"
    },
    {
        "title": "Çocukluk dönemi aşı takviminde değişikliğe gidiliyor",
        "date": "2025-03-19",
        "source": "AA",
        "text": "Sağlık Bakanlığınca Hepatit B aşısı ile beş bileşenli karma aşıyı bir araya getiren \"altı bileşenli karma aşı\" uygulanmasına, 14 Nisan'da başlanacak.\n\n\n19/03/2025 10:28\n© TRT HABER"
    },
    {
        "title": "Sağlık Bakanlığı, 2 milyonu aşkın hastaya 'evde sağlık hizmeti' verdi",
        "date": "2025-03-18",
        "source": "DHA",
        "text": "Sağlık Bakanlığı, 1 Şubat 2010 tarihinden 2024 yılı sonuna kadar 2 milyon 780 bin 50 hastaya 'evde sağlık hizmeti' verildiğini duyurdu.\n18/03/2025 15:40\n© TRT HABER"
    },
    {
        "title": "Ankara'da randevu talebi bekleme süresi yarıya düştü",
        "date": "2025-03-17",
        "source": "AA",
        "text": "Ankara İl Sağlık Müdürü Ali Niyazi Kurtcebe, Merkezi Hekim Randevu Sistemi (MHRS) kapasitesinin artmasıyla randevu talebi bekleme sürelerinin yüzde 50'nin altına düştüğünü açıkladı.\n17/03/2025 11:48\n© TRT HABER"
    },
    {
        "title": "Beyin ölümü gerçekleşen kişinin organları 5 hastaya umut oldu",
        "date": "2025-03-15",
        "source": "AA",
        "text": "Samsun'da tedavi gördüğü hastanede beyin ölümü gerçekleşen 53 yaşındaki kişinin bağışlanan organları 5 kişiye nakledilecek.\n15/03/2025 05:34\n© TRT HABER"
    },
    {
        "title": "Türkiyede modern tıbbın yolculuğu",
        "date": "2025-03-14",
        "source": "TRT Haber",
        "text": "II. Mahmud’un kurduğu Tıphane-i Amire ile temelleri atılan modern tıp eğitimi, yıllar içinde köklü reformlarla gelişerek bugünün güçlü sağlık sistemine dönüştü. Gelişmiş tıbbi teknolojiler ve alanında uzman hekimlerle Türkiye, sağlık alanında önemli mesafeler katetti. \n14/03/2025 11:56\n© TRT HABER"
    },
    {
        "title": "Bakan Memişoğlu: Hekimlik bir meslekten öte bir adanmışlık hikayesi",
        "date": "2025-03-13",
        "source": "AA",
        "text": "Sağlık Bakanı Kemal Memişoğlu, hekimlerin sağlık sisteminin övünç kaynağı olduğunu belirterek, hekimler ve hekim adaylarının 14 Mart Tıp Bayramı'nı kutladı.\n14/03/2025 01:15\n© TRT HABER"
    },
    {
        "title": "Tetanosdifteriaselüler boğmaca aşısı aşılama programına eklendi",
        "date": "2025-03-13",
        "source": "AA",
        "text": "Sağlık Bakanlığı, anne ve yenidoğan bebeğini korumak amacıyla tetanos-difteri (Td) aşısının bir dozunun her gebelik döneminde aselüler boğmaca aşısı bileşeni de içeren \"tetanos-difteri-aselüler boğmaca (Tdab) aşısı\" şeklinde uygulanmasına 2 Nisan'da başlanacağını bildirdi.\n13/03/2025 15:50\n© TRT HABER"
    },
    {
        "title": "Gözlerdeki sinsi tehdit: Glokom",
        "date": "2025-03-13",
        "source": "TRT Haber",
        "text": "“Göz tansiyonu” olarak da bilinen glokom, sessizce ilerleyen hastalık. Erken teşhis edilmezse körlüğe yol açabiliyor. Glokomdan korunmak için, özellikle 40 yaşından sonra yıllık göz kontrollerinin aksatılmaması önemli. \n13/03/2025 14:45\n© TRT HABER"
    },
    {
        "title": "İstanbul'da günde yaklaşık 10 bin hasta diyalize giriyor",
        "date": "2025-03-13",
        "source": "AA",
        "text": "İstanbul'daki 92 merkezde günde yaklaşık 10 bin hasta diyaliz hizmeti alıyor.\n13/03/2025 14:28\n© TRT HABER"
    },
    {
        "title": "Reçete yazdırmak isteyen hastalar acil servislerin verimliliğini düşürüyor",
        "date": "2025-03-13",
        "source": "AA",
        "text": "Hayati tehlikesi bulunan hastalara hızlı müdahale için kritik rol üstlenen acil servislerin, reçete ve rapor yazdırmak amacıyla yapılan başvurular nedeniyle verimliliğinin düştüğü ve bunun acil vakaların önünde engel oluşturabileceği bildirildi.\n13/03/2025 11:03\n© TRT HABER"
    },
    {
        "title": "AB kritik ilaç üretimini artırmak istiyor",
        "date": "2025-03-11",
        "source": "AA",
        "text": "Avrupa Birliği (AB), ilaçlarda yaşanan tedarik sıkıntısını gidermek ve kritik ilaçların Avrupa'da üretimini sağlamak için yasa hazırladı.\n11/03/2025 22:20\n© TRT HABER"
    },
    {
        "title": "Sağlıklı Hayat Merkezi danışmanlığında 5 ayda 31 kilo verdi",
        "date": "2025-03-08",
        "source": "AA",
        "text": "Antalya'da kiloları nedeniyle çeşitli sağlık problemleri yaşayan 36 yaşındaki İdris Kalp, Sağlık Bakanlığının Sağlıklı Hayat Merkezinden ücretsiz diyetisyen desteği alarak ve sürekli bisiklete binerek 5 ayda 31 kilo verdi.\n08/03/2025 11:51\n© TRT HABER"
    },
    {
        "title": "2024 yılında 373 bin bağımlı AMATEMlere başvurdu",
        "date": "2025-03-05",
        "source": "AA",
        "text": "Sağlık Bakanı Kemal Memişoğlu, \"2024 yılında 373 bin bağımlı AMATEM’lere tedavi için başvurdu, bunlardan 10 bin 473'ü yatarak tedavi oldu.\" dedi.\n05/03/2025 17:37\n© TRT HABER"
    },
    {
        "title": "Bağımlıların dayanağı: YEDAM",
        "date": "2025-03-05",
        "source": "TRT Haber",
        "text": "Yeşilay çatısı altında hizmet veren YEDAM, 2015’ten bu yana bağımlılıkla mücadele edenlerin yanında… Türkiye’nin dört bir yanındaki merkezlerde bugüne dek 1 milyon 300 binden fazla çağrıya yanıt verildi. \n05/03/2025 09:52\n© TRT HABER"
    },
    {
        "title": "Obezite sağlık sorunlarına davetiye çıkarıyor",
        "date": "2025-03-04",
        "source": "TRT Haber",
        "text": "Obezite kalp damar hastalıklarından uyku apnesine, iskelet sistemi rahatsızlıklarından çeşitli kanserlere kadar pek çok ciddi sağlık problemine yol açabiliyor. Bu küresel sağlık tehdidiyle mücadele ise doğru beslenme ve düzenli egzersiz yapmaktan geçiyor.\n04/03/2025 11:23\n© TRT HABER"
    },
    {
        "title": "Reflü hastaları Ramazan'da neye dikkat etmeli?",
        "date": "2025-03-04",
        "source": "TRT Haber",
        "text": "Ramazan ayında yeme içme alışkanlıklarının değişmesi reflüyü tetikleyebiliyor. Peki, bunun önüne geçmek için nelere dikkat edilmeli? Detaylar haberimizde. \n04/03/2025 07:32\n© TRT HABER"
    },
    {
        "title": "Omurgadaki sinsi tehlike: Skolyoz",
        "date": "2025-03-04",
        "source": "TRT Haber",
        "text": "Skolyoz yani omurga eğriliği, özellikle ergenlik yaşındaki çocuklarda ortaya çıkıyor. Omurgadaki eğrilik 10 dereceyi geçiyorsa, hastalık tanısı konuluyor. Uzmanlar, skolyozun teşhis edilmesinde ailelere büyük bir görev düştüğünü söylüyor.\n04/03/2025 07:25\n© TRT HABER"
    },
    {
        "title": "Sağlık Bakanlığı Nadir Hastalıklar Veri Sistemi'nde kayıtlı hasta sayısı 13 bine ulaştı",
        "date": "2025-03-03",
        "source": "AA",
        "text": "Sağlık Bakanlığınca, nadir hastalıkların tespitini ve takibini yapmak amacıyla kurulan Nadir Hastalıklar Veri Sistemi'ne 2022'den bugüne 13 bine yakın hasta kaydedildi.\n03/03/2025 11:39\n© TRT HABER"
    },
    {
        "title": "MHRS'de randevu bekleyen hasta sayısı yüzde 61 azaldı",
        "date": "2025-03-02",
        "source": "AA",
        "text": "Sağlık Bakanlığı, Merkezi Hekim Randevu Sisteminde (MHRS) randevu bekleyen hasta sayısının yüzde 61 azaldığını duyurdu.\n02/03/2025 15:13\n© TRT HABER"
    },
    {
        "title": "Türk hekimlerin geliştirdiği teknik literatüre girdi",
        "date": "2025-03-02",
        "source": "AA",
        "text": "Türk hekimlerin beyin cerrahisinde uyguladıkları yeni cerrahi teknik sayesinde, ameliyat sonrası ortaya çıkabilecek beyin-omurilik sıvısı (BOS) kaçağı büyük ölçüde önlendi.\n02/03/2025 11:27\n© TRT HABER"
    },
    {
        "title": "Sağlık Bakanlığı'ndan ramazanda sağlıklı beslenme önerileri",
        "date": "2025-02-28",
        "source": "AA",
        "text": "Sağlık Bakanlığı, ramazan ayında yeterli ve dengeli beslenmenin sürdürülebilmesi amacıyla sağlıklı beslenme önerilerini açıkladı.\n28/02/2025 21:37\n© TRT HABER"
    },
    {
        "title": "Nadir görülen hastalıklarda umut veren gelişmeler",
        "date": "2025-02-28",
        "source": "TRT Haber",
        "text": "Kimi zaman tanı koyulabilmesi bile zorlu bir süreç gerektiren nadir görülen hastalıkların tedavisi konusunda tıbbın ilerlemesiyle birlikte önemli gelişmeler yaşanıyor. Gen tedavisi, kişiselleştirilmiş tıp, hedefe yönelik tedaviler bu hastalıktan muzdarip olanlara umut veriyor.\n28/02/2025 09:33\n© TRT HABER"
    },
    {
        "title": "Dünya genelinde yaklaşık 400 milyon insan nadir hastalıklarla mücadele ediyor",
        "date": "2025-02-27",
        "source": "AA",
        "text": "Dünya çapında tespit edilen yaklaşık 7 bin nadir hastalık, çoğunluğu çocuk yaklaşık 400 milyon insanı etkiliyor.\n27/02/2025 12:03\n© TRT HABER"
    },
    {
        "title": "Sağlık Bakanlığı: Randevu talepleri yüzde 58 oranında azaldı",
        "date": "2025-02-25",
        "source": "DHA",
        "text": "Sağlık Bakanlığı, Merkezi Hekim Randevu Sistemi, üzerinden randevu bekleyen kişi sayısının 2024 yılının aralık ayında 2 milyon 490 bin 559 iken 2025 yılının şubat ayında 1 milyon 96 bin 163'e gerilediğini ve bekleyen randevu taleplerinin yüzde 58 oranında azaldığını duyurdu.\n25/02/2025 11:40\n© TRT HABER"
    },
    {
        "title": "Sağlık Bakanlığı tütünle mücadelede dizi yapımcılarıyla işbirliğine gidiyor",
        "date": "2025-02-25",
        "source": "AA",
        "text": "Sağlık Bakanlığı, sigara ve diğer tütün ürünlerinin kullanımının azaltılması için dizi ve film sektörünün önde gelen yapımcıları ile bir araya gelerek, tütün karşıtı mesajların daha fazla yer alması için işbirliği yapacak.\n25/02/2025 11:31\n© TRT HABER"
    },
    {
        "title": "Özbekistanlı bebeklere umut ışığı Türkiye'de doğdu",
        "date": "2025-02-25",
        "source": "AA",
        "text": "Özbekistan'da karaciğer yetmezliği tanısı konulan 9 ve 6 aylık iki bebek, tedavi için getirildikleri İstanbul'da nakil ameliyatıyla sağlıklarına kavuştu.\n25/02/2025 11:03\n© TRT HABER"
    },
    {
        "title": "Sağlık Bakanlığı 3 ayda 10,5 milyon kronik hastalık taraması yaptı",
        "date": "2025-02-22",
        "source": "AA",
        "text": "Sağlık Bakanlığı, 8 bin 255 Aile Sağlığı Merkezi ve 29 bin 74 aile hekimliği birimi tarafından 1 Kasım-31 Ocak tarihleri arasında 10 milyon 564 bin 192 kişiye kronik hastalık taraması ve izlem gerçekleştirildiğini açıkladı.\n22/02/2025 16:01\n© TRT HABER"
    },
    {
        "title": "Sağlık Bakanlığı'ndan kalp krizi arttı iddialarına açıklama",
        "date": "2025-02-19",
        "source": "AA",
        "text": "Sağlık Bakanlığı, Türkiye İstatistik Kurumunun (TÜİK) yayınladığı ölüm ve ölüm nedeni istatistiklerindeki verilere dayanarak 15-24, 25-34, 35-44 yaş gruplarının 2011-2023 yıllarında kalp krizinden ölüm hızında kayda değer bir farklılık olmadığını açıkladı.\n19/02/2025 12:05\n© TRT HABER"
    },
    {
        "title": "Geçit vermeyen yolları aşıp mahsur kalan hastalara umut oldular",
        "date": "2025-02-19",
        "source": "AA",
        "text": "Ulusal Medikal Kurtarma Ekibi, yoğun kar yağışı ve dondurucu soğukların etkili olduğu Bingöl'de yolu kapanan yerleşim birimlerinde mahsur kalan hastaların imdadına yetişiyor.\n19/02/2025 11:29\n© TRT HABER"
    },
    {
        "title": "Aldatıcı sağlık beyanı cezaları artırıldı: 4 milyon 750 bin liraya kadar ceza uygulanacak",
        "date": "2025-02-19",
        "source": "AA",
        "text": "Sosyal ağlar, internet siteleri, televizyon kanalları gibi mecralarda tüketiciyi aldatıcı sağlık beyanıyla ürün tanıtımı ve satış yapanlara yönelik idari para cezaları artırıldı. Ulusal televizyon kanalları aracılığıyla gerçekleştirilen tanıtım ve satışlara 4 milyon 750 bin liraya kadar ceza uygulanacak.\n\n19/02/2025 11:29\n© TRT HABER"
    },
    {
        "title": "Tütünle mücadelede yeni yol haritası belirleniyor",
        "date": "2025-02-18",
        "source": "AA",
        "text": "Sağlık Bakan Yardımcısı Şuayıp Birinci, tütün ve tütün ürünleriyle mücadelede daha yeni ve daha güçlü bir anlayışla sahaya çıkmayı planladıklarını belirterek, \"Tütünle mücadeledeki yaklaşımlarımızı revize etmek durumundayız.\" dedi.\n18/02/2025 13:39\n© TRT HABER"
    },
    {
        "title": "Bilinçsiz vitamin kullanımı vücuda zarar veriyor",
        "date": "2025-02-18",
        "source": "TRT Haber",
        "text": "Kış mevsiminde bağışıklığı güçlendirmek adına bilinçsiz vitamin kullanımı artıyor. Oysa dengeli beslenildiğinde vücutta vitamin eksikliği yaşanmıyor. Uzmanlar, doktor önerisi dışında kullanılan bu vitaminlerin vücuda ciddi zarar verdiğini söylüyor.\n18/02/2025 12:25\n© TRT HABER"
    },
    {
        "title": "Çocukluk çağında yakalanan kanserlerde tedavi başarı oranı yüksek",
        "date": "2025-02-16",
        "source": "AA",
        "text": "Bilkent Şehir Hastanesi Çocuk Hastanesi Çocuk Hematoloji ve Onkoloji Uzmanı Prof. Dr. Neriman Sarı, Türkiye'de çocukluk çağı kanser türlerinde tedavi başarı oranlarının yüzde 70'in üzerine çıktığını aktardı.\n16/02/2025 11:33\n© TRT HABER"
    },
    {
        "title": "Türkiye genelinde 1000 aile sağlığı merkezi açılacak",
        "date": "2025-02-13",
        "source": "AA",
        "text": "Sağlık Bakanlığı Halk Sağlığı Genel Müdürü Muhammed Emin Demirkol, \"1000 aile sağlığı merkezi ve 100 sağlıklı hayat merkezi tüm Türkiye'de bu yıl sonunda açılmış olacak. Bu kapsamda yoğun bir şekilde yatırımlar ve açılış çalışmaları devam ediyor.\" dedi.\n13/02/2025 13:28\n© TRT HABER"
    },
    {
        "title": "Sağlık Bakanlığında Tütünle Mücadele Çalıştayı düzenlendi",
        "date": "2025-02-12",
        "source": "TRT Haber-AA",
        "text": "Sağlık Bakan Yardımcısı Şuayip Birinci, \"Pasif içiciler, farkına varmadan tütün ve tütün ürünlerinin zararlarına maruz kalıyor. Bu süreci iyi yönetmek ve etkili önlemler almak zorundayız\" dedi.\n12/02/2025 23:54\n© TRT HABER"
    },
    {
        "title": "81 ilde çapraz denetimle duman avı",
        "date": "2025-02-12",
        "source": "AA",
        "text": "Sağlık Bakanlığı, Türkiye genelinde kafe ve restoranlarda yeşil dedektörler ve çapraz denetim ekipleriyle sigara denetimine çıkacak.\n12/02/2025 11:16\n© TRT HABER"
    },
    {
        "title": "Gıdada numune alma ve analiz metodu kriterlerinde güncellemeye gidildi",
        "date": "2025-02-12",
        "source": "AA",
        "text": "Gıdalardaki eser elementler ve işleme bulaşanlarının, resmi kontrolü için numune alma ve analiz metodu kriterleri yeniden belirlendi.\n12/02/2025 10:54\n© TRT HABER"
    },
    {
        "title": "Körfez turunda 3 ülkeyle işbirlikleri güçlendirildi",
        "date": "2023-07-20",
        "source": "TRT Haber",
        "text": "Cumhurbaşkanı Recep Tayyip Erdoğan'ın Suudi Arabistan, Katar ve Birleşik Arap Emirlikleri'ni kapsayan Körfez ziyaretinde birçok alanda 18 anlaşma ve bir ortak bildiri imzalandı.\n\n21/07/2023 00:31\n© TRT HABER"
    },
    {
        "title": "Tahıl koridorundan 33 milyon tona yakın tahıl taşındı",
        "date": "2023-07-20",
        "source": "AA",
        "text": "Rusya-Ukrayna savaşı nedeniyle gıda krizi riskinin ortadan kaldırılması amacıyla oluşturulan tahıl koridorundan bugüne kadar 33 milyon tona yakın tahıl taşındı.\n\n21/07/2023 00:27\n© TRT HABER"
    },
    {
        "title": "Çocuklarda sorumluluk bilinci nasıl gelişir?",
        "date": "2023-07-20",
        "source": "TRT Haber",
        "text": "Küçük yaşlardan itibaren çocuklara sorumluluk bilinci aşılamak onların öz güvenini pekiştiriyor. Peki, aileler nasıl davranmalı?\n\n21/07/2023 00:25\n© TRT HABER"
    },
    {
        "title": "Seyahatsever ile tatilde ücretsiz konaklamak mümkün",
        "date": "2023-07-14",
        "source": "TRT Haber",
        "text": "Gençlik ve Spor Bakanlığı Seyahatsever projesi ile öğrenci yurtlarının kapılarını 18-30 yaş aralığındaki gençlere açıyor. Belirlenen noktalarda ücretsiz konaklamak için öğrenci olma şartı da yok.\n14/07/2023 14:23\n© TRT HABER"
    },
    {
        "title": "Yaz geldi kene vakaları arttı",
        "date": "2023-07-13",
        "source": "TRT Haber",
        "text": "Sıcak havalarla birlikte artan kene vakaları Kırım Kongo Kanamalı Ateşi’ni yeniden gündeme getirdi. Keneyle bulaşan bu hastalığa yakalanmamak için önlem almak gerekiyor. Dikkat edilmesi gerekenlerin başında ise kenenin doğru şekilde vücuttan çıkarılması geliyor.\n13/07/2023 09:40\n© TRT HABER"
    },
    {
        "title": "Ne güzel şeysin sen, hep yaşın 19: Özkan Uğur",
        "date": "2023-07-11",
        "source": "TRT Haber",
        "text": "Mazhar Fuat Özkan (MFÖ) üçlüsünden Özkan Uğur hayatını kaybetti. Uzun süredir lenf kanseri ile mücadele eden Uğur'un başarılarla dolu hikayesini sizler için derledik...\n\n11/07/2023 17:39\n© TRT HABER"
    },
    {
        "title": "Kurban eti nasıl saklanır? Kurban eti ne kadar dinlendirilmeli?",
        "date": "2023-07-11",
        "source": "TRT Haber",
        "text": "Müslümanlar kurban ibadetini yerine getirmeye başladı. Kurban etlerini sağlıklı bir şekilde saklamak içinse dikkat edilmesi gerekenler var. Peki, kurban eti nasıl saklanır? Kurban eti ne kadar dinlendirilmeli? Kurban eti yıkanır mı?\n\n11/07/2023 14:21\n© TRT HABER"
    },
    {
        "title": "Avrupanın ortasında soykırım: Srebrenitsa",
        "date": "2023-07-11",
        "source": "TRT Haber",
        "text": "Takvimler 11 Temmuz 1995’i gösteriyordu... Dünya, insanlık tarihinin gördüğü en korkunç olaylardan birine tanık oldu. Srebrenitsa’da 8 bin 372 Müslüman Boşnak katledildi. Boşnak milletinin en derin yarası Srebrenitsa soykırımının 28. yılı.\n\n11/07/2023 14:17\n© TRT HABER"
    },
    {
        "title": "Okulların açılma tarihi belli oldu",
        "date": "2023-07-11",
        "source": "TRT Haber",
        "text": "Milli Eğitim Bakanlığı, 2023-2024 Eğitim ve Öğretim Yılı Çalışma Takvimi'ni açıkladı. İlk ders zili 11 Eylül'de çalacak.\n\n11/07/2023 14:14\n© TRT HABER"
    },
    {
        "title": "İncire giden yol İlekleme",
        "date": "2023-07-04",
        "source": "TRT Haber",
        "text": "Şarkıda söylendiği gibi \"incirler olana kadar kalmak\" sadece zaman meselesi değil, aynı zamanda bir emek ve fedakarlık meselesi. Kalması istenen kişi ne yaptı bilmiyoruz ancak incirin ne zaman ve nasıl olacağını İzmir’in Tire ilçesi Akyurt Köyü'ne giderek öğrendik. İlekleme işlemiyle…\n04/07/2023 17:18\n© TRT HABER"
    },
    {
        "title": "Ölüm ve ölüm istatistikleri açıklandı: Ölüm sayısı yüzde 10,9 azaldı",
        "date": "2023-07-04",
        "source": "TRT Haber",
        "text": "Türkiye'de 2022 yılında ölüm sayısı bir önceki yıla göre yüzde 10,9 azalarak 504 bin 839 olurken, söz konusu yılda yaşamını yitirenlerin yüzde 54,6'sını erkekler, yüzde 45,4'ünü kadınlar oluşturdu.\n\n04/07/2023 17:14\n© TRT HABER"
    },
    {
        "title": "Üniversite mezunlarında istihdam oranı yüzde 71,7 oldu",
        "date": "2023-07-04",
        "source": "TRT Haber",
        "text": "Türkiye'de lisans mezunlarında istihdam oranı 2022'de yüzde 71,7 olarak gerçekleşirken, ilk iş bulma süresi 13,9 ay olarak hesaplandı.\n\n04/07/2023 17:09\n© TRT HABER"
    },
    {
        "title": "Fransa yangın yeri: Ülkedeki hasar 1 milyar euro",
        "date": "2023-07-03",
        "source": "TRT Haber",
        "text": "Fransa'da 17 yaşındaki Cezayir asıllı gencin polis kurşunuyla ölümünün ardından başlayan olaylar önceki günlere kıyasla azaldı. Ancak Marsilya ve Lyon'da tansiyon yine yüksekti.Olaylarda çıkan yangına müdahale eden bir itfaiye erinin hayatını kaybettiği açıklandı. Fransa'daki olayların en az 1 milyar euroluk hasara yol açtığı tahmin ediliyor\n\n03/07/2023 21:32\n© TRT HABER"
    },
    {
        "title": "10 soruda kızamık hastalığı",
        "date": "2023-06-22",
        "source": "TRT Haber",
        "text": "Ateş, halsizlik, öksürük ve deri döküntüleri gibi belirtiler gösteren kızamık, bulaşıcılığı en fazla olan hastalıklar arasında. Ancak güvenli ve etkili aşısı sayesinde aynı zamanda önlenebilir bir hastalık. Öyle ki iki doz kızamık aşısı yaptıranlar yüzde 95 ila 99 oranında hastalıktan korunuyor.\n\n22/06/2023 22:33\n© TRT HABER"
    },
    {
        "title": "Asgari ücret artışı birçok kalemi etkileyecek",
        "date": "2023-06-22",
        "source": "TRT Haber",
        "text": "Asgari ücretin 1 Temmuz 2023 itibarıyla brüt 13 bin 414 lira 50 kuruş, net 11 bin 402 lira 32 kuruşa yükseltilmesiyle işsizlik ödeneğinden genel sağlık sigortası (GSS) primine, kıdem tazminatından staj ücretine kadar birçok kalemde değişiklik olacak.\n\n22/06/2023 22:31\n© TRT HABER"
    },
    {
        "title": "2023te 3 bine yakın tarihi eser ait oldukları topraklara döndü",
        "date": "2023-06-22",
        "source": "TRT Haber",
        "text": "Yurt dışına yasa dışı yollarla kaçırılan tarihi eserler, Türkiye’ye getirilmeye devam ediyor. 2023’ün başından bu yana 2 bin 956 eser daha Türkiye’ye iade edilerek müzelerde koruma altına alındı.\n\n22/06/2023 22:28\n© TRT HABER"
    },
    {
        "title": "Türkiye hep yeşil kalsın, kuraklık olmasın",
        "date": "2023-06-17",
        "source": "TRT Haber",
        "text": "Türkiye’de bu yıl 25 bin hektar alanda Erozyon Kontrol Tesis Çalışması gerçekleştirildi, toplamda ise 40 bin hektar alanda toprak koruması yapılıyor. Bütün çabalar, Türkiye’nin kurak bir çöle dönüşmemesi, hep yeşil ve yaşanabilir kalması için…\n\n17/06/2023 11:50\n© TRT HABER"
    },
    {
        "title": "İstanbul Avrupa'da en çok oyun anlaşması yapılan 2. şehir",
        "date": "2023-06-16",
        "source": "TRT Haber",
        "text": "2022 Türkiye Oyun Sektörü Raporu'na göre İstanbul, Londra'dan sonra Avrupa'da en çok oyun anlaşması yapılan şehir oldu. İşte raporun öne çıkan istatistikleri…\n16/06/2023 20:45\n© TRT HABER"
    },
    {
        "title": "5 Haziran Dünya Çevre Günü: Plastik kirliliğine çözüm aranıyor",
        "date": "2023-06-15",
        "source": "TRT Haber",
        "text": "Çevre kirliliği, iklim değişikliği, ormansızlaşma gibi sorunlar ve insan nüfusundaki aşırı artış, dünya üzerindeki işleyişi büyük ölçüde değiştiriyor. Çevreye zarar veren insan faaliyetleri için farkındalık oluşturmak adına 5 Haziran, Dünya Çevre Günü olarak kabul ediliyor. Bu yılki tema ise plastik kirliliğine çözüm üretmeye odaklanıyor.\n\n15/06/2023 23:25\n© TRT HABER"
    },
    {
        "title": "Epilepsi nöbetlerini tetikleyici faktörlere dikkat",
        "date": "2023-06-15",
        "source": "TRT Haber",
        "text": "Dünya nüfusunun yüzde 1’ini etkileyen epilepsi, sık görülen bir nörolojik hastalık. Hekim gözetiminde düzenli ilaç kullanımıyla kontrol altına alınan epilepside, hastaların nöbetleri tetikleyici faktörlerden uzak durmaları gerekiyor.\n15/06/2023 23:22\n© TRT HABER"
    },
    {
        "title": "Merkez Bankası sitesinde Hafize Gaye Erkan güncellemesi",
        "date": "2023-06-15",
        "source": "TRT Haber",
        "text": "Türkiye Cumhuriyet Merkez Bankası (TCMB) Başkanı Dr. Hafize Gaye Erkan'ın öz geçmişi, Banka'nın internet sitesine eklendi.\n15/06/2023 09:45\n© TRT HABER"
    },
    {
        "title": "Savunma sanayiinde bayrak değişimi: Yeni yol haritası nasıl olacak?",
        "date": "2023-06-15",
        "source": "TRT Haber",
        "text": "Yeni hükümet ve hemen ardından gelen atama kararlarıyla yeni dönemin kadrosu da şekillenmiş oldu. Savunma Sanayii Başkanlığı’nda Prof. Dr. İsmail Demir’in yerine ASELSAN CEO’su Haluk Görgün atandı. Demir’in çok başarılı bir döneme imza attığını anlatan savunma sanayii uzmanları, Görgün döneminde bu başarının katlanabileceği beklentisinde.\n15/06/2023 09:34\n© TRT HABER"
    },
    {
        "title": "Savunma sanayiinde millileşme sürüyor",
        "date": "2023-06-15",
        "source": "TRT Haber",
        "text": "Türk savunma sanayiine yön veren Cumhurbaşkanlığı Savunma Sanayii Başkanlığı'ndaki görev değişimi sonrası yılın kalanında da birçok projede önemli gelişmeler yaşanacak.\n\n15/06/2023 09:22\n© TRT HABER"
    },
    {
        "title": "Türk sinemasının unutulmaz ismi: Sümer Tilmaç",
        "date": "2023-06-12",
        "source": "TRT Haber",
        "text": "\"Gönül Yarası\", \"Reis Bey\", \"Kanlı Nigar\", \"Kuruluş Osmancık\" ve \"Süper Baba\" adlı yapımlarda canlandırdığı rollerle Türk sinemasının unutulmaz isimleri arasına giren Sümer Tilmaç, Türk izleyicisinin gönlünde yer edindi.\n12/06/2023 15:01\n© TRT HABER"
    },
    {
        "title": "1920'den bu yana Meclis Başkanları",
        "date": "2023-06-12",
        "source": "TRT Haber",
        "text": "TBMM, 103 yılda Mustafa Kemal Atatürk'ten Numan Kurtulmuş'a 30 Meclis Başkanı'na ev sahipliği yaptı.\n12/06/2023 09:56\n© TRT HABER"
    },
    {
        "title": "Bayram tatili 9 gün oldu",
        "date": "2023-06-11",
        "source": "TRT Haber",
        "text": "Cumhurbaşkanı Recep Tayyip Erdoğan, Kurban Bayramı tatilinin 9 gün olacağını duyurdu. Erdoğan, \"26-27 Haziran tarihlerini idari izin kapsamına almayı kararlaştırdık. Vatandaşlarımız toplam 9 gün bayram tatili yapma imkanı bulacaktır\" dedi.\n\n11/06/2023 09:28\n© TRT HABER"
    },
    {
        "title": "Buğday ve arpa alım fiyatları belli oldu",
        "date": "2023-06-11",
        "source": "TRT Haber",
        "text": "Cumhurbaşkanı Recep Tayyip Erdoğan, Toprak Mahsulleri Ofisi'nin buğday ve arpa alım fiyatlarını açıkladı. Buna göre, çiftçi kayıt sistemine kayıtlı çiftçinin eline ton başına ekmeklik buğdayda 9 bin 250 lira, arpada ise 7 bin 500 lira geçecek.\n\n11/06/2023 09:25\n© TRT HABER"
    },
    {
        "title": "Zafer uğruna yerle bir oldular: Kanlı şehir savaşları",
        "date": "2023-06-11",
        "source": "TRT Haber",
        "text": "Berlin, Halep, Beyrut… Milyonlarca insanın hayatını kaybettiği, geride kalanlar için katlanılmaz acılar bırakan savaşlar birçok şehri yerle bir etti. Tarihteki örneklerden ders alınmadığının en iyi göstergesi ise devam eden Rusya-Ukrayna Savaşı oldu. İşte zafer uğruna harabeye çevrilen şehirlerdeki kanlı savaşlardan örnekler...\n\n11/06/2023 09:23\n© TRT HABER"
    },
    {
        "title": "76 Türk balıkçı gemisi Akdenizde Mavi Yüzgeçli Orkinos mesaisinde",
        "date": "2023-06-11",
        "source": "TRT Haber",
        "text": "Dünyanın en değerli balıkları arasında yer alan Mavi Yüzgeçli Orkinos mesaisi başladı. Akdeniz’de Türkiye’ye tanınan 2 bin 600 ton kota için 29 balıkça gemisi ve 47 taşıma gemisi mesai yapıyor. Çalışmalar ise merkezde, uydudan takip ediliyor.\n\n11/06/2023 09:21\n© TRT HABER"
    },
    {
        "title": "Meclis'te sandalye dağılımı",
        "date": "2023-06-11",
        "source": "TRT Haber",
        "text": "28. Dönem Milletvekili Seçimi kesin sonuçları açıklandı.\n11/06/2023 09:16\n© TRT HABER"
    },
    {
        "title": "Cumhurbaşkanı Erdoğan: Kazanan sadece biz değiliz, kazanan Türkiye'dir",
        "date": "2023-06-11",
        "source": "TRT Haber",
        "text": "Cumhurbaşkanı Recep Tayyip Erdoğan, \"Milletimizin her iradesi gibi bu sonucun da başımızın üstünde yeri vardır. Fakat kazanan sadece biz değiliz. Kazanan Türkiye'dir, kazanan tüm kesimleriyle milletimizin ta kendisidir, kazanan demokrasimizdir.\" dedi.\n\n11/06/2023 09:12\n© TRT HABER"
    },
    {
        "title": "İstanbul Havalimanı Avrupa'nın en yoğun havalimanı oldu",
        "date": "2023-06-09",
        "source": "TRT Haber",
        "text": "İstanbul Havalimanı, haziranın ilk haftasında günlük ortalama 1423 uçuşla Avrupa'nın en yoğun havalimanı oldu.\n\n09/06/2023 17:20\n© TRT HABER"
    },
    {
        "title": "Türkiye'nin en yeşil kentleri",
        "date": "2023-06-09",
        "source": "TRT Haber",
        "text": "Türkiye'deki toplam orman alanı, 2023 yılında 23 milyon 245 bin hektar oldu. Antalya, 1 milyon 177 bin hektar ile Türkiye'de en fazla ormana sahip kent. Yüz ölçümüne göre yüzde 72'si orman olan Karabük, kişi başına düşen 29 bin 426 metrekare orman alanı ile de Tunceli, ilk sırada yer alıyor.\n\n09/06/2023 17:16\n© TRT HABER"
    },
    {
        "title": "Orman yangınlarıyla mücadelede yeni dönem",
        "date": "2023-06-09",
        "source": "TRT Haber",
        "text": "Yaz aylarının en önemli risklerinden biri geniş çaplı orman yangınları. Ankara, hızlı müdahale için etkili bir filo kurmayı hedefliyor. İnsanlı/insansız farklı tipte platformların karma olarak kullanılacağı yeni yol haritası yaklaşık 30 yıldır orman yangınlarına havadan müdahale eden Türkiye için değerli bir başlangıç anlamı taşıyor.\n\n09/06/2023 17:12\n© TRT HABER"
    },
    {
        "title": "Akdeniz anemisinin kesin çözümü: Kemik iliği nakli",
        "date": "2023-06-09",
        "source": "TRT Haber",
        "text": "Akdeniz anemisi olarak da bilinen talasemi, taşıyıcılarda önemli bir soruna sebep olmazken, hastalarda ağır kansızlığa yol açıyor. Henüz bebekken tespit edilen hastalığın kalıcı çözümü ise kemik iliği nakli.\n\n09/06/2023 17:10\n© TRT HABER"
    },
    {
        "title": "SMA tedavisi için İstanbula nadir hastalıklar hastanesi kurulacak",
        "date": "2023-06-09",
        "source": "TRT Haber",
        "text": "Sağlık Bakanı Fahrettin Koca, nadir hastalıkların tedavisi için İstanbul'da yeni bir hastane kuracaklarını, bu hastanenin hücre ve gen terapilerinin uygulanmasına özel olacağını açıkladı.\n\n09/06/2023 17:08\n© TRT HABER"
    },
    {
        "title": "Bebeklerde hipotiroidi ihmale gelmiyor",
        "date": "2023-06-09",
        "source": "TRT Haber",
        "text": "Yenidoğan Tarama Programı kapsamında tespit edilen konjenital hipotiroidi, acil tedavi gerektiren bir sorun. İhmal edildiği taktirde başta zeka geriliği olmak üzere bebeklerde ciddi sağlık problemlerine yol açıyor. Oysaki hekim kontrolünde düzenli ilaç kullanımıyla kolayca tedavi edilebiliyor.\n\n09/06/2023 17:07\n© TRT HABER"
    },
    {
        "title": "Cumhurbaşkanı Seçimi kesin sonuçları açıklandı",
        "date": "2023-06-02",
        "source": "TRT Haber",
        "text": "YSK Başkanı Yener, Cumhurbaşkanı Seçimi ikinci oylaması kesin sonuçlarına göre Recep Tayyip Erdoğan'ın yüzde 52,18, Kemal Kılıçdaroğlu'nun yüzde 47,82 oranında oy aldığını açıkladı.\n02/06/2023 09:27\n© TRT HABER"
    },
    {
        "title": "Plastik kirliliğini önleyen anlaşma yapılabilecek mi?",
        "date": "2023-06-02",
        "source": "TRT Haber",
        "text": "Paris İklim Sözleşmesi’nden sonra dünya çevre adına yeni bir anlaşma için toplandı. Birleşmiş Milletler’in 2024 sonunda imzalamayı kabul ettiği anlaşma plastik kirliliğinin sona ermesi yönünde alınacak önlemleri içeriyor. Bağlayıcı olacak bu anlaşma için ülkelerin ve büyük şirketlerin fikir birliğine varıp varamayacağı merak konusu.\n02/06/2023 09:22\n© TRT HABER"
    },
    {
        "title": "Okuma yazma oranı yüzde 97,6'ya yükseldi",
        "date": "2023-06-02",
        "source": "TRT Haber",
        "text": "Türkiye'de okuma yazma bilenlerin oranı geçen yıl itibarıyla yüzde 97,6'ya çıkarken ortalama eğitim süresi en yüksek il Ankara oldu.\n02/06/2023 09:18\n© TRT HABER"
    },
    {
        "title": "Osteoporoz gelişme riski yaşla birlikte artıyor",
        "date": "2023-05-24",
        "source": "TRT Haber",
        "text": "Kemik erimesi ya da diğer adıyla osteoporoz, sinsi seyreden bir hastalık. Genellikle kemikte kırık meydana gelmeden belirti vermeyen osteoporoza karşı önlem almada doğru beslenme ve düzenli egzersiz önemli rol oynuyor.\n\n24/05/2023 17:07\n© TRT HABER"
    },
    {
        "title": "Küçük bir hangarda başlayan efsane: THY 90 yaşında",
        "date": "2023-05-20",
        "source": "TRT Haber",
        "text": "20/05/2023 15:54\n© TRT HABER"
    },
    {
        "title": "4 ayda 8 milyona yakın kişi müze ve ören yerlerini ziyaret etti",
        "date": "2023-05-19",
        "source": "TRT Haber",
        "text": "Kültür ve Turizm Bakanlığı’na bağlı 212 müze ve 144 ören yeri bulunuyor. Yurt içinden ve yurt dışından her gün binlerce kişinin yolu bu adreslere düşüyor. Müze ve ören yerleri 2023’ün başında bu yana 8 milyona yakın ziyaretçiyi ağırladı.\n\n19/05/2023 10:52\n© TRT HABER"
    },
    {
        "title": "Özgür Savaşan Şahinlerin teslimatı başladı",
        "date": "2023-05-19",
        "source": "TRT Haber",
        "text": "19/05/2023 10:48\n© TRT HABER"
    },
    {
        "title": "Türkiye'de nüfusun 12,9 milyonu genç",
        "date": "2023-05-17",
        "source": "TRT Haber",
        "text": "TÜİK'in İstatistiklerle Gençlik 2022 çalışmasına göre, 2022 sonu itibariyle Türkiye'de 12 milyon 949 bin 817 genç bulunuyor.\n\n17/05/2023 14:55\n© TRT HABER"
    },
    {
        "title": "Meclis'in ilk mesaisi yemin töreni",
        "date": "2023-05-17",
        "source": "TRT Haber",
        "text": "Seçimlerin ardından, Türkiye Büyük Millet Meclisi'nde yeni yasama dönemi yemin töreniyle başlayacak. Cumhurbaşkanlığı kabinesinden 16 bakan, yeni dönemde milletvekili koltuklarında oturacak.\n\n17/05/2023 14:24\n© TRT HABER"
    },
    {
        "title": "Sırada sedan ve Cross Coupe var.",
        "date": "2023-05-17",
        "source": "TRT Haber",
        "text": "Günde 80 araç çıkarabilecek kapasiteye erişen tesiste 3 dakikada 1 Togg üretilmesi planlanıyor.\n17/05/2023 14:22\n© TRT HABER"
    },
    {
        "title": "Obezite sıklığı diyabeti de artırıyor",
        "date": "2023-05-17",
        "source": "TRT Haber",
        "text": "Dünyada 537 milyon, Türkiye’de ise 9 milyon kişi diyabet hastası. Üstelik bu rakamların önümüzdeki yıllarda daha da artması bekleniyor. Obezite diyabetin en önemli nedenleri arasında gösteriliyor.\n17/05/2023 14:19\n© TRT HABER"
    },
    {
        "title": "Dünyada en çok konuşulan 6'ncı dil: Türkçe",
        "date": "2023-05-17",
        "source": "TRT Haber",
        "text": "Türkçe eski bir dil olmasının yanı sıra, en çok konuşulan diller arasında 6'ncı sırada yer alıyor. Köklü bir geçmişi olan Türkçenin asırlar boyu yolculuğunu, Türk Dil Bayramı'nın 746. yılında anlattık.\n\n17/05/2023 14:10\n© TRT HABER"
    },
    {
        "title": "Yorgunluk kronik bir sorun olabilir mi?",
        "date": "2023-05-17",
        "source": "TRT Haber",
        "text": "Aylar boyunca süren yorgunluk pek çok insanın sorunu… Çözüm için sağlık kuruluşlarına başvuranlar önce yorgunluğa sebep olabilecek hastalıklar açısından irdeleniyor. Kronik yorgunluk tanısı alındığında ise spesifik tedavisi olmayan bir sürece giriliyor. Sorunu çözmek için çeşitli branşlardan hekimler birlikte hareket ediyor.\n\n17/05/2023 14:06\n© TRT HABER"
    },
    {
        "title": "Kamu işçilerinin maaş artışı belli oldu: İşte hakları ve zam oranları...",
        "date": "2023-05-17",
        "source": "TRT Haber",
        "text": "Kamuda çalışan 700 binden fazla işçinin zam oranı belli oldu. En düşük kamu işçisi ücreti 15 bin liraya yükseldi. İlk 6 ay için yüzde 45 zamda anlaşmaya varıldı. Peki, kamu işçilerine başka hangi hakları verildi, diğer 6 ay için ne kadar zam alacaklar?\n\n17/05/2023 14:02\n© TRT HABER"
    },
    {
        "title": "Merkezi sistem ve ön ödemeli sayaçlarda doğal gaz indirimi nasıl olacak?",
        "date": "2023-05-17",
        "source": "TRT Haber",
        "text": "Karadeniz gazının karaya çıkarılmasının ardından verilen \"Doğal gaz müjdesi\" hayata geçirildi. Konutlarda, ibadethane ve cemevlerinde doğalgaz kullanımı 1 ay süreyle ücretsiz oldu. Uygulamadan merkezi sistem ve ön ödemeli sayaç aboneleri de yararlanacak.\n\n17/05/2023 13:59\n© TRT HABER"
    },
    {
        "title": "Zayıflama hayali kabusa dönüşmesin: Obezite cerrahisinde hataya yer yok",
        "date": "2023-05-17",
        "source": "TRT Haber",
        "text": "Obezite oranlarındaki artış, cerrahiye başvuruları da artırdı. Ancak deneyim sahibi kişiler tarafından yapılmayan obezite ameliyatları olumsuz sonuçlar doğurabiliyor. Ucuz maliyetler sunarak kazanç sağlamaya çalışan bazı merkezlerin günde 8-10 operasyon yaptığı belirtiliyor.\n\n17/05/2023 13:56\n© TRT HABER"
    },
    {
        "title": "Seçimde ikinci tur süreci nasıl işleyecek?",
        "date": "2023-05-17",
        "source": "TRT Haber",
        "text": "Yüksek Seçim Kurulu (YSK) Başkanı Ahmet Yener, adayların seçilme yeterliliğini elde edememesi nedeniyle cumhurbaşkanlığı seçiminin ikinci tura kaldığını açıkladı. Peki 28 Mayıs'ta yapılacak ikinci tur seçim süreci nasıl işleyecek, oy pusulaları nasıl olacak?\n\n17/05/2023 13:52\n© TRT HABER"
    },
    {
        "title": "Milletvekili Genel Seçimi Sonuçları",
        "date": "2023-05-17",
        "source": "TRT Haber",
        "text": "17/05/2023 13:50\n© TRT HABER"
    },
    {
        "title": "Adım adım oy kullanma rehberi",
        "date": "2023-05-13",
        "source": "TRT Haber",
        "text": "Seçmenler, yarın gerçekleştirilecek Cumhurbaşkanı Seçimi ve 28. Dönem Milletvekili Genel Seçimi'nde oylarını 6 adımda kullanacak.\n\n13/05/2023 14:33\n© TRT HABER"
    },
    {
        "title": "Türk tiyatrosuna adanan ömür: Haldun Taner",
        "date": "2023-05-13",
        "source": "TRT Haber",
        "text": "Başarılı yazar, 1960'tan itibaren tiyatro çalışmalarına yoğunlaşırken, güncel olayları konu alan eleştirel oyunları sunabilmek amacıyla kabare tiyatrosunun kuruluşuna öncülük etti.\n13/05/2023 14:30\n© TRT HABER"
    },
    {
        "title": "Son 63 yılın en yağışsız ikinci kışı",
        "date": "2023-05-13",
        "source": "TRT Haber",
        "text": "2023 yılı kış mevsiminde yağışlar normalin altına düştü. Ancak kurak kışın ardından nisan yağışlı geçti. İşte Meteoroloji'nin verileri...\n\n13/05/2023 14:27\n© TRT HABER"
    },
    {
        "title": "Dünya Göçmen Kuşlar Günü: Bu yılın odak noktası Su",
        "date": "2023-05-13",
        "source": "TRT Haber",
        "text": "Göçmen kuşların büyük bölümünün yaşam döngüsünü aslında su belirliyor. Sulak alanlar, nehirler, göller ve bataklıklar kuşların beslenmesine, yuva yapmasına, uzun yolculukları sırasında dinlenip enerji depolamalarına imkan sağlıyor. Dünya Göçmen Kuşlar Günü’nde suyun önemine ve Türkiye’nin nasıl kritik bir göç rotası olduğuna yakından baktık.\n\n13/05/2023 14:24\n© TRT HABER"
    },
    {
        "title": "Kral 3. Charles tacını giydi",
        "date": "2023-05-13",
        "source": "TRT Haber",
        "text": "İngiltere Kralı 3. Charles, başkent Londra'daki tarihi Westminster Abbey Kilisesi'nde düzenlenen dini törenle taç giydi. Törenin ardından kiliseden ayrılarak Buckingham Sarayı'na geri dönen Kral Charles ve Kraliçe Camilla balkona çıkarak halkı selamladı.\n\n13/05/2023 14:20\n© TRT HABER"
    },
    {
        "title": "Milli judoculardan Ümitler Avrupa Kupası'nda 3 madalya",
        "date": "2025-04-06",
        "source": "AA",
        "text": "Milli sporcular, Ümitler Avrupa Judo Kupası'nın Çekya ayağında 1 altın ve 2 bronz madalya kazandı.\n06/04/2025 23:18\n© TRT HABER"
    },
    {
        "title": "Türkiye Kupası'nda yarı final eşleşmeleri belli oldu",
        "date": "2025-04-03",
        "source": "AA",
        "text": "Geçen sezonun Türkiye Kupası şampiyonu Beşiktaş, çeyrek finalde Göztepe'ye 3-1 yenilerek kupa macerasını noktaladı. Böylece Ziraat Türkiye Kupası'nda yarı final eşleşmeleri belli oldu. Tek maç eleme usulüne göre yapılacak yarı finalde Trabzonspor-Göztepe ve Konyaspor-Galatasaray müsabakaları oynanacak.\n03/04/2025 22:54\n© TRT HABER"
    },
    {
        "title": "Novak Djokovic, Miami Açık'ta finale yükseldi",
        "date": "2025-03-28",
        "source": "AA",
        "text": "Miami Açık Tenis Turnuvası'nda Bulgar Grigor Dimitrov'u 2-0 yenen Sırp Novak Djokovic, finale çıktı. Djokovic, Federer'i geride bırakarak ATP 1000 Masters turnuvalarında finale çıkan en yaşlı tenisçi oldu.\n29/03/2025 00:20\n© TRT HABER"
    },
    {
        "title": "Bakan Bak: Ülkemiz, Avrupa'nın en modern stadyumlarına sahip",
        "date": "2025-03-26",
        "source": "AA",
        "text": "Gençlik ve Spor Bakanı Osman Aşkın Bak, \"Ülkemiz, dünyanın en büyük ve Avrupa'nın en modern stadyumlarına sahip. Bu stadyumların sayısı 40'a ulaştı. Uluslararası standartlarda stadyumlar var\" dedi.\n26/03/2025 18:20\n© TRT HABER"
    },
    {
        "title": "Türkiye'de 34 ilin ihracatı ocakşubat döneminde arttı",
        "date": "2025-03-17",
        "source": "AA",
        "text": "Ticaret Bakanlığı, ocak-şubat döneminde 10 ilin ihracatının 1 milyar doların üzerine çıktığını, 34 ilde de ihracat artışı gerçekleştiğini bildirdi.\n17/03/2025 09:15\n© TRT HABER"
    },
    {
        "title": "FIFA, 2030 Dünya Kupası'nı 64 takıma çıkarmayı değerlendiriyor",
        "date": "2025-03-07",
        "source": "The Guardian",
        "text": "FIFA, 2030 Erkekler Dünya Kupası’na katılacak takım sayısını 64’e çıkarmayı gündemine aldı. Bu olasılık hayata geçerse, FIFA’nın 211 üye federasyonunun dörtte birinden fazlası turnuvada yer alma şansı yakalayacak.\n07/03/2025 07:22\n© TRT HABER"
    },
    {
        "title": "Derbide kazanan çıkmadı",
        "date": "2025-02-24",
        "source": "AA",
        "text": "Trendyol Süper Lig'in 25. haftasındaki Galatasaray-Fenerbahçe derbisi 0-0 beraberlikle sonuçlandı.\n24/02/2025 22:01\n© TRT HABER"
    },
    {
        "title": "Celtic taraftarlarından İsrail'e 'kırmızı kart'",
        "date": "2025-02-12",
        "source": "AA",
        "text": "İskoçya ekibi Celtic'in taraftarları, takımlarının UEFA Şampiyonlar Ligi'nde Bayern Münih'i ağırladıkları maçta işgalci İsrail'in Filistin ve Lübnan'a yönelik saldırılarına tepki gösterdi.\n13/02/2025 01:39\n© TRT HABER"
    },
    {
        "title": "Adana Demirspor Kulübü Başkanı istifa etti",
        "date": "2025-02-10",
        "source": "TRT Haber",
        "text": "Adana Demirspor Kulübü Başkanı Bedirhan Durak, görevinden istifa ettiğini duyurdu.\n10/02/2025 09:59\n© TRT HABER"
    },
    {
        "title": "Alperen Şengün, NBA'de AllStar 2025'e seçildi",
        "date": "2025-01-31",
        "source": "AA",
        "text": "NBA'de Houston Rockets forması giyen milli yıldız Alperen Şengün, Batı Konferansı All-Star kadrosuna seçildi.\n31/01/2025 03:21\n© TRT HABER"
    },
    {
        "title": "Türkiye'de eihracat 2024'te 6,4 milyar dolara yaklaştı",
        "date": "2025-01-30",
        "source": "AA",
        "text": "Ticaret Bakanlığı E-İhracat, Dijital Pazarlama, Davranışsal Kamu Politikaları ve Yeni Nesil Teknolojiler Daire Başkanı Hasan Önal, Türkiye'de e-ihracatın 2024 yılında 6,4 milyar dolara yaklaştığını söyledi.\n\n\n30/01/2025 16:15\n© TRT HABER"
    },
    {
        "title": "UEFA Şampiyonlar Ligi ve Avrupa Ligi'nde playoff kura çekimi yarın yapılacak",
        "date": "2025-01-30",
        "source": "AA",
        "text": "UEFA Şampiyonlar Ligi ve UEFA Avrupa Ligi'nde son 16 play-off turu kura çekimi yarın gerçekleştirilecek.\n\n\n30/01/2025 09:32\n© TRT HABER"
    },
    {
        "title": "Gençlik Kampları yeni yılda 43 noktada kapılarını açtı",
        "date": "2025-01-21",
        "source": "AA",
        "text": "Gençlik ve Spor Bakanlığı (GSB) tarafından her yıl ücretsiz düzenlenen gençlik kampları, 2025'te 43 kamp merkezinde faaliyetlere başladı.\n21/01/2025 11:43\n© TRT HABER"
    },
    {
        "title": "Milli golbolcü Şeydanur engelleri sporla aşıyor",
        "date": "2025-01-14",
        "source": "AA",
        "text": "Dünya şampiyonası ve olimpiyatlarda elde ettikleri başarılarla ülkeyi gururlandıran Golbol Kadın Milli Takımı'nın 25 yaşındaki oyuncusu Şeydanur Kaplan, kariyeriyle engellilere örnek oluyor.\n14/01/2025 11:43\n© TRT HABER"
    },
    {
        "title": "Milli halterciler, 2024'te 236 madalya kazandı",
        "date": "2025-01-13",
        "source": "AA",
        "text": "Türkiye Halter Federasyonu Başkanı Talat Ünlü, geçen yıl uluslararası yarışmalarda 71'i altın 236 madalya kazandıklarını söyledi.\n13/01/2025 11:21\n© TRT HABER"
    },
    {
        "title": "Bakan Bak: Spor sahalarında şiddetin yeri yoktur",
        "date": "2025-01-11",
        "source": "TRT Haber",
        "text": "Gençlik ve Spor Bakanı Osman Aşkın Bak, Şanlıurfa Güneşin Çocukları Kadın Hentbol Takımı'nın  oyuncularına yapılan saldırıyı kınayarak, \"Spor sahalarında şiddetin yeri yoktur\" dedi.\n\n12/01/2025 00:05\n© TRT HABER"
    },
    {
        "title": "Sarıkamış şehitleri anısına, Kardan Heykeller Sergisi",
        "date": "2025-01-04",
        "source": "AA",
        "text": "Gençlik ve Spor Bakanı Osman Aşkın Bak, Sarıkamış Şehitleri'ni anma programı kapsamında yapılan \"Kardan Heykeller Sergisi'nin\" açılışını, Aile ve Sosyal Hizmetler Bakanı Mahinur Özdemir Göktaş ile gerçekleştirdi.\n04/01/2025 18:13\n© TRT HABER"
    },
    {
        "title": "Milli sporcular 2024 yılında 7 bin 500 madalya kazandı",
        "date": "2024-12-31",
        "source": "AA",
        "text": "Gençlik ve Spor Bakanı Osman Aşkın Bak, milli sporcuların 2024 yılında uluslararası organizasyonlarda 7 bin 500 madalya kazandığını belirtti.\n31/12/2024 12:19\n© TRT HABER"
    },
    {
        "title": "Taha Akgül, Türkiye Güreş Federasyonu'nun yeni başkanı oldu",
        "date": "2024-12-18",
        "source": "AA",
        "text": "Türkiye Güreş Federasyonu Olağan Genel Kurulu'nda başkanlığa Taha Akgül seçildi.\n18/12/2024 15:01\n© TRT HABER"
    },
    {
        "title": "Milli yüzücü Kuzey Tunçelli, dünya üçüncüsü oldu",
        "date": "2024-12-10",
        "source": "AA",
        "text": "Milli yüzücü Kuzey Tunçelli, Dünya Kısa Kulvar Şampiyonası'nda bronz madalya kazanarak büyük bir başarıya imza attı.\n10/12/2024 21:58\n© TRT HABER"
    },
    {
        "title": "Bakan Bak, milli yüzücü Kuzey Tunçelli'yi tebrik etti",
        "date": "2024-12-10",
        "source": "AA",
        "text": "Gençlik ve Spor Bakanı Osman Aşkın Bak, Macaristan'da düzenlenen Dünya Kısa Kulvar Yüzme Şampiyonası'nda dünya gençler rekoru kırarak bronz madalya kazanan Kuzey Tunçelli'yi kutladı.\n10/12/2024 21:56\n© TRT HABER"
    },
    {
        "title": "TFF: Fenerbahçe Ziraat Türkiye Kupası'na katılmayacağını bildirdi",
        "date": "2024-12-06",
        "source": "DHA",
        "text": "Türkiye Futbol Federasyonu, Fenerbahçe'nin 2024-25 sezonunda Ziraat Türkiye Kupası müsabakalarına katılım sağlamayacağını açıkladı. Federasyon, ilgili kurullarla gerekli değerlendirmenin yapılacağını da duyurdu.\n06/12/2024 20:43\n© TRT HABER"
    },
    {
        "title": "Antrenörlük mesleğine 'Ulusal Meslek Standardı' geliyor",
        "date": "2024-12-05",
        "source": "AA",
        "text": "Gençlik ve Spor Bakanlığı ile Mesleki Yeterlilik Kurumu arasında antrenörlük mesleğinin tanımının yapılması, kademeler arası yeterliliklerin belirlenmesi ve uluslararası geçerliliği bulunan bir belgelendirme sisteminin oluşturulması amacıyla iş birliği protokolü imzalandı.\n05/12/2024 16:24\n© TRT HABER"
    },
    {
        "title": "Beşiktaş'ta başkanlık görevine Hüseyin Yücel getirildi",
        "date": "2024-11-29",
        "source": "AA",
        "text": "Beşiktaş Kulübü, Başkan Hasan Arat'ın istifasının yönetim kurulu tarafından kabul edildiğini ve başkanlık görevine ikinci başkan Hüseyin Yücel'in getirildiğini duyurdu.\n29/11/2024 21:31\n© TRT HABER"
    },
    {
        "title": "Hasan Arat, Beşiktaş'a veda etti",
        "date": "2024-11-29",
        "source": "AA",
        "text": "Hasan Arat, Beşiktaş Kulübü Başkanlığı'ndan istifa ettiğini açıkladı.\n29/11/2024 14:43\n© TRT HABER"
    },
    {
        "title": "Dünya Kupası Avrupa elemeleri kurasında Türkiye 2. torbada",
        "date": "2024-11-28",
        "source": "AA",
        "text": "ABD, Meksika ve Kanada'nın ortaklaşa düzenleyeceği 2026 FIFA Dünya Kupası için Avrupa elemelerinde UEFA'ya bağlı ülkelerin yer alacağı torbalar belli oldu. Türkiye, 2. torbada yer alacak.\n28/11/2024 20:29\n© TRT HABER"
    },
    {
        "title": "A Milli Futbol Takımı 3 yılın ardından İstanbul'a dönüyor",
        "date": "2024-11-28",
        "source": "AA",
        "text": "A Milli Futbol Takımı'nın Macaristan ile 20 ve 23 Mart 2025'te yapacağı UEFA Uluslar Ligi play-off müsabakalarının statları belli oldu.\n28/11/2024 16:38\n© TRT HABER"
    },
    {
        "title": "İsrailli holiganlar Fransa'da olay çıkardı",
        "date": "2024-11-14",
        "source": "AA",
        "text": "Paris'teki Fransa-İsrail futbol karşılaşması sırasında İsrailli holiganlar kavga çıkardı. Taşkınlık çıkaran İsrailliler, Fransız taraftarlara saldırdı.\n15/11/2024 00:23\n© TRT HABER"
    },
    {
        "title": "Kayseri'de milli maç heyecanı",
        "date": "2024-11-14",
        "source": "AA",
        "text": "A Milli Futbol Takımı'nın UEFA Uluslar B Ligi 4. Grup'ta Galler ile oynayacağı karşılaşmaya ev sahipliği yapacak Kayseri'de milli maç heyecanı yaşanıyor.\n\n\n14/11/2024 11:25\n© TRT HABER"
    },
    {
        "title": "Türk hakemler uluslararası arenada görev alıyor",
        "date": "2024-11-05",
        "source": "AA",
        "text": "Türk hakemler Halil Umut Meler, Zorbay Küçük ve Kadir Sağlam yarın uluslararası müsabakalarda görev yapacak.\n05/11/2024 20:16\n© TRT HABER"
    },
    {
        "title": "Perende atarak kullandığı taç asist oldu",
        "date": "2024-11-05",
        "source": "İHA",
        "text": "Bölgesel Amatör Ligi'nde oynanan müsabakada, 1966 Edremitspor kulübünde forma giyen futbolcunun perende atarak kullandığı tacı takım arkadaşı gole çevirdi.\n05/11/2024 10:09\n© TRT HABER"
    },
    {
        "title": "Milli halterciden 2 altın, 1 gümüş madalya",
        "date": "2024-11-02",
        "source": "AA",
        "text": "Polonya'da devam eden Gençler ve 23 Yaş Altı Avrupa Halter Şampiyonası'nda 23 yaş altı erkekler 109 kiloda milli sporcu Muhammed Emin Burun, 2 altın, 1 gümüş madalya kazandı.\n02/11/2024 21:45\n© TRT HABER"
    },
    {
        "title": "Medine Saime Balaban Avrupa Halter Şampiyonası'nda bronz madalya kazandı",
        "date": "2024-10-30",
        "source": "AA",
        "text": "Polonya'da devam eden Gençler ve 23 Yaş Altı Avrupa Halter Şampiyonası'nda milli halterci Medine Saime Balaban, bronz madalya kazandı.\n30/10/2024 20:37\n© TRT HABER"
    },
    {
        "title": "Milli halterci Aysel Özkan'dan koparmada bronz madalya",
        "date": "2024-10-29",
        "source": "AA",
        "text": "Polonya'da devam eden Gençler ve 23 Yaş Altı Avrupa Halter Şampiyonası'nda milli halterci Aysel Özkan, bronz madalya elde etti.\n29/10/2024 20:17\n© TRT HABER"
    },
    {
        "title": "Milli atıcılarımız Avrupa şampiyonu",
        "date": "2024-10-26",
        "source": "TRT Haber, AA",
        "text": "Havalı Silahlar Avrupa Şampiyonlar Ligi Havalı Tabanca takım finalinde ev sahibi Sırbistan'ı 3-1 yenen milli sporcular Yusuf Dikeç ve Şimal Yılmaz, altın madalyanın sahibi oldu.\n26/10/2024 19:09\n© TRT HABER"
    },
    {
        "title": "Futbol kulüpleri TUSAŞ'a yönelik terör saldırısını kınadı",
        "date": "2024-10-23",
        "source": "AA",
        "text": "Futbol kulüpleri, Türk Havacılık ve Uzay Sanayii Anonim Şirketine (TUSAŞ) yönelik terör saldırısını kınadı.\n23/10/2024 19:36\n© TRT HABER"
    },
    {
        "title": "Ampute Futbol Milli Takımı Balkan şampiyonu oldu",
        "date": "2024-10-17",
        "source": "AA",
        "text": "Ampute Futbol Milli Takımı, Arnavutluk'ta düzenlenen organizasyonda Balkan şampiyonu oldu.\n17/10/2024 22:02\n© TRT HABER"
    },
    {
        "title": "Bakan Bak: Türkiye'deki tesis ve organizasyonların sayısı artıyor",
        "date": "2024-10-16",
        "source": "AA",
        "text": "Bakan Bak, \"Spor bir ortak dil. Sporun gücü kitleleri etkileyen, yönlendiren bir gerçek. Sporun gücü evrensel. Spor bir diplomasi metodu. Ülkeyle, dünyayla ilgili anlatmak istediklerinizi çok rahat şekilde ifade edebiliyorsunuz. Aranızda inanılmaz bir iletişim ortaya çıkıyor\" açıklamasını yaptı.\n16/10/2024 18:10\n© TRT HABER"
    },
    {
        "title": "İzlanda'dan namağlup lider dönüyoruz",
        "date": "2024-10-14",
        "source": "TRT Haber, AA",
        "text": "A Milli Futbol Takımı, UEFA Uluslar B Ligi 4. Grup dördüncü maçında deplasmanda İzlanda'yı 4-2 mağlup etti.\n14/10/2024 23:41\n© TRT HABER"
    },
    {
        "title": "A Milliler Karadağ'ı mağlup etti",
        "date": "2024-10-11",
        "source": "TRT Haber",
        "text": "A Milli Futbol Takımı, UEFA Uluslar B Ligi 4. Grup'taki üçüncü maçında Samsun'da Karadağ'ı 1-0 mağlup etti.\n11/10/2024 23:40\n© TRT HABER"
    },
    {
        "title": "Galatasaray galibiyetle başladı",
        "date": "2024-09-25",
        "source": "AA",
        "text": "Galatasaray, UEFA Avrupa Ligi ilk hafta maçında Yunanistan'ın PAOK takımını 3-1 mağlup etti.\n25/09/2024 23:51\n© TRT HABER"
    },
    {
        "title": "Türkiye, Paris 2024 Paralimpik Oyunları'nda rekor üstüne rekor kırdı",
        "date": "2024-09-09",
        "source": "AA",
        "text": "Paris 2024 Paralimpik Oyunları'nda Türkiye, tarihinin en iyi organizasyonuna imza attı. Rekor sporcuyla katılım sağladığı oyunları Türkiye, altın madalya ve toplam madalya sayısında rekorla tamamladı.\n09/09/2024 11:54\n© TRT HABER"
    },
    {
        "title": "Milli basketbolcu İlkan Karaman hayatını kaybetti",
        "date": "2024-09-08",
        "source": "AA",
        "text": "Milli basketbolcu İlkan Karaman geçirdiği trafik kazasında hayatını kaybetti.\n08/09/2024 12:11\n© TRT HABER"
    },
    {
        "title": "Besra Duman'dan para halterde gümüş madalya",
        "date": "2024-09-05",
        "source": "AA",
        "text": "Paris 2024 Paralimpik Oyunları'nda para halterde milli sporcu Besra Duman, kadınlar 55 kiloda gümüş madalya kazandı.\n05/09/2024 19:06\n© TRT HABER"
    },
    {
        "title": "Türkiye, Paris 2024'te madalya rekoru kırdı",
        "date": "2024-09-05",
        "source": "AA",
        "text": "Paris 2024 Paralimpik Oyunları'nda Türkiye, katıldığı müsabakalarda 7 madalya kazanırken, toplamda 20'ye yükseldi.\n05/09/2024 18:59\n© TRT HABER"
    },
    {
        "title": "Golbol Kadın Milli Takımımız İsrail'i yenerek Paris'te tarih yazdı",
        "date": "2024-09-05",
        "source": "AA",
        "text": "Golbol Kadın Milli Takımı, Paris 2024 Paralimpik Oyunları'nın finalinde İsrail'i 8-3 yenerek üst üste üçüncü kez altın madalya kazandı.\n05/09/2024 18:55\n© TRT HABER"
    },
    {
        "title": "Ecem Taşın Çavdar'dan Paris'te bronz madalya",
        "date": "2024-09-05",
        "source": "AA",
        "text": "Paris 2024 Paralimpik Oyunları'nda judoda kadınlar 48 kilo J1 kategorisinde Ecem Taşın Çavdar, bronz madalya kazandı.\n05/09/2024 18:53\n© TRT HABER"
    },
    {
        "title": "Golbol Kadın Milli Takımı finalde",
        "date": "2024-09-04",
        "source": "AA",
        "text": "Paris 2024 Paralimpik Oyunları'nda mücadele eden Golbol Kadın Milli Takımı, yarı finalde Brezilya'yı 3-1 mağlup ederek finale yükseldi.\n04/09/2024 23:30\n© TRT HABER"
    },
    {
        "title": "Nazmiye Muratlı'dan bronz madalya",
        "date": "2024-09-04",
        "source": "AA",
        "text": "Paris 2024 Paralimpik Oyunları'nda para halterde milli sporcu Nazmiye Muratlı, kadınlar 45 kiloda bronz madalya kazandı.\n\n04/09/2024 19:34\n© TRT HABER"
    },
    {
        "title": "Çanakkale Boğazı'ndaki yarışta bin 300 yüzücü Avrupa'dan Asya'ya kulaç attı",
        "date": "2024-08-30",
        "source": "AA",
        "text": "Çanakkale Boğazı'nda bu yıl 37'ncisi düzenlenen Çanakkale Boğazı Wilusa Yüzme Yarışı'nda, 20 ülkeden bin 300 yüzücü mücadele etti.\n30/08/2024 14:03\n© TRT HABER"
    },
    {
        "title": "Paralimpik Oyunları'nda ilk gümüş madalya Ali Can Özcan'dan geldi",
        "date": "2024-08-29",
        "source": "AA",
        "text": "Paris 2024 Paralimpik Oyunları'nda milli tekvandocu Ali Can Özcan, erkekler K44 58 kiloda gümüş madalya kazandı.\n\n29/08/2024 22:22\n© TRT HABER"
    },
    {
        "title": "Paralimpik Oyunları'nda ilk madalyamız Meryem Betül Çavdar'dan geldi",
        "date": "2024-08-29",
        "source": "AA",
        "text": "Paris 2024 Paralimpik Oyunları'nda milli tekvandocu Meryem Betül Çavdar, kadınlar K44 52 kiloda bronz madalya kazandı ve Türkiye oyunlardaki ilk madalyasını aldı.\n29/08/2024 21:49\n© TRT HABER"
    },
    {
        "title": "Başakşehir, UEFA Konferans Ligi'nde lig aşamasına yükseldi",
        "date": "2024-08-28",
        "source": "AA",
        "text": "UEFA Konferans Ligi play-off turunda 0-0'ın rövanşında İrlanda ekibi St. Patrick's Athletic'i 2-0 mağlup eden RAMS Başakşehir, adını lig aşamasına yazdırdı.\n28/08/2024 21:18\n© TRT HABER"
    },
    {
        "title": "Ferdi Kadıoğlu 30 milyon euro bonservisle Brighton'da",
        "date": "2024-08-27",
        "source": "AA",
        "text": "Fenerbahçe, milli futbolcu Ferdi Kadıoğlu'nun İngiltere Premier Lig ekiplerinden Brighton'a 30 milyon avro bonservis ücretiyle transfer olduğunu duyurdu.\n27/08/2024 22:18\n© TRT HABER"
    },
    {
        "title": "Eski teknik direktör Christoph Daum vefat etti",
        "date": "2024-08-25",
        "source": "AA",
        "text": "Fenerbahçe, Beşiktaş ve Bursaspor’da görev yapan Alman teknik direktör Christoph Daum, 70 yaşında hayatını kaybetti.\n25/08/2024 06:12\n© TRT HABER"
    },
    {
        "title": "Milli bilek güreşçiden 3 ayda 2 şampiyonluk",
        "date": "2024-08-24",
        "source": "AA",
        "text": "Milli bilek güreşçi Ahmet Efe Kendirci, 3 ay içerisinde Avrupa ve dünya şampiyonluğu mutlulukları yaşadı.\n24/08/2024 12:49\n© TRT HABER"
    },
    {
        "title": "Tekvando: Bir spordan çok daha fazlası",
        "date": "2024-08-07",
        "source": "TRT Haber",
        "text": "Güney Kore'nin ulusal sporu tekvando, bir dövüş sanatı olmanın ötesinde öğretileriyle de ayrı bir anlam taşıyor. Kökeni yüzyıllar öncesine dayanan tekvando; saygı, nezaket ve alçak gönüllülük gibi değerler üzerine inşa ediliyor. Türkiye'de de 1960'lı yıllardan bu yana varlık gösteren Tekvando ile dünya çapında büyük başarılara imza atılıyor.\n07/08/2024 22:55\n© TRT HABER"
    },
    {
        "title": "14 yaşındaki milli yüzücü Ela'dan 1 ayda 3 madalya",
        "date": "2024-08-04",
        "source": "AA",
        "text": "Milli yüzücü Ela İşcan, Güney Kıbrıs ve Sırbistan'daki turnuvalarda 1 ay içinde 2 altın, 1 bronz madalya kazanıp 200 metre kurbağalamada elinde bulundurduğu 14 yaş Türkiye rekorunu da geliştirdi.\n04/08/2024 14:07\n© TRT HABER"
    },
    {
        "title": "Mersindeki atıcılık kompleksine Yusuf Dikeç ile Şevval İlayda Tarhanın adı verildi",
        "date": "2024-08-04",
        "source": "AA",
        "text": "Paris 2024 Olimpiyatları'nda karışık takım 10 metre havalı tabancada kazandıkları gümüş madalyayla oyunlar tarihinde Türkiye'ye atıcılıktaki ilk madalyasını getiren Yusuf Dikeç ve Şevval İlayda Tarhan’ın isimleri, Mersin’deki olimpik atıcılık kompleksine verildi.\n04/08/2024 10:44\n© TRT HABER"
    },
    {
        "title": "Süper Kupa'nın sahibi Beşiktaş",
        "date": "2024-08-03",
        "source": "AA",
        "text": "Beşiktaş, Galatasaray'ı 5-0 mağlup ederek Turkcell Süper Kupa'nın sahibi oldu.\n03/08/2024 22:44\n© TRT HABER"
    }
]